{
  "caseID": "core_02",
  "title": "The Pumpkin Brawl",
  "description": "Two men from the Block D community garden got into a fight over their prize pumpkins. One pumpkin was destroyed, a market stall was damaged, and both men are blaming each other. Determine who started the altercation.",
  "caseType": "Core",
  "firstAvailableDay": 2,
  "coreSequenceNumber": 2,
  "reward": 65.0,
  "extraRewardForState": 0.0,
  "suspicionReduction": 0.0,
  "requiredPreviousCaseIds": ["core_01"],
  "unlocksNextCaseIds": ["core_03"],

  "cardImagePath": "Cases/core_02/card",

  "lawBroken": "Agitation (Deviation from the Fifth Tenet §5)",
  "involvesResistance": false,
  "resistanceChoice": "",
  "stateChoice": "Convict the aggressor who started the fight and destroyed the pumpkin.",

  "minDiscoveredCluesToAllowCommit": 3,
  "allowCommitWithLowConfidence": true,

  "clueVerdictMappings": [
    { "clueId": "clue_pumpkin_destroyed", "slotId": "violation", "optionId": "agitation", "label": "Agitation" },
    { "clueId": "clue_pumpkin_destroyed", "slotId": "violation", "optionId": "destruction_of_property", "label": "Destruction of Property" },
    { "clueId": "clue_borislav_started", "slotId": "violation", "optionId": "agitation", "label": "Agitation" },
    { "clueId": "clue_stall_damage", "slotId": "violation", "optionId": "destruction_of_property", "label": "Destruction of Property" }
  ],

  "suspects": [
    {
      "citizenID": "citizen_borislav",
      "firstName": "Borislav",
      "lastName": "Kovac",
      "picturePath": "Portraits/citizen_borislav",
      "dateOfBirth": "11/03/1975",
      "gender": "Male",
      "ethnicity": "Caucasian",
      "maritalStatus": "Married",
      "address": "22 Garden Row, Block D",
      "occupation": "Bricklayer",
      "nervousnessLevel": 0.50,
      "initialStress": 0.35,
      "isGuilty": true,
      "criminalHistory": [],
      "tagInteractions": [
        {
          "tagId": "clue_enforcer_report",
          "tagQuestion": "The enforcer report says you and Goran were fighting in the market square. What happened?",
          "responses": [
            {
              "responseSequence": ["Goran started it. He's been talking trash about my pumpkin for weeks.", "He said mine was rotten inside. In front of everyone. I pushed him. That's it."],
              "isLie": true,
              "stressImpact": 0.06,
              "responseType": "Defensive",
              "clickableClues": []
            }
          ],
          "unlocksTruthForTagIds": [],
          "contradictedByEvidenceTagIds": ["clue_borislav_started"],
          "contradictionResponse": {
            "responseSequence": ["Okay, maybe I threw the first punch.", "But he had it coming. You should have heard what he said about my pumpkin."],
            "isLie": false,
            "stressImpact": 0.10,
            "responseType": "Defensive",
            "clickableClues": []
          },
          "responseVariants": []
        },
        {
          "tagId": "clue_pumpkin_destroyed",
          "tagQuestion": "Goran's pumpkin was smashed during the fight. Did you destroy it?",
          "responses": [
            {
              "responseSequence": ["It fell off the table during the scuffle. I didn't smash it on purpose.", "Things got knocked around. It was chaos."],
              "isLie": true,
              "stressImpact": 0.08,
              "responseType": "Evasive",
              "clickableClues": []
            }
          ],
          "unlocksTruthForTagIds": [],
          "contradictedByEvidenceTagIds": ["clue_borislav_started"],
          "contradictionResponse": {
            "responseSequence": ["Fine. I grabbed it and threw it on the ground.", "His pumpkin was bigger than mine. I was angry. It was stupid."],
            "isLie": false,
            "stressImpact": 0.12,
            "responseType": "Emotional",
            "clickableClues": [
              {
                "clueId": "clue_borislav_motive",
                "clickableText": "His pumpkin was bigger than mine",
                "noteText": "<person>Borislav</person> admits he destroyed <person>Goran</person>'s pumpkin out of jealousy because it was larger than his own",
                "highlightColor": { "r": 1.0, "g": 0.92, "b": 0.0, "a": 1.0 },
                "oneTimeOnly": true
              }
            ]
          }
        },
        {
          "tagId": "clue_stall_damage",
          "tagQuestion": "A market stall was damaged in the fight. Who knocked it over?",
          "responses": [
            {
              "responseSequence": ["That was Goran. He shoved me into it.", "I was just defending myself."],
              "isLie": true,
              "stressImpact": 0.06,
              "responseType": "Defensive",
              "clickableClues": []
            }
          ],
          "unlocksTruthForTagIds": []
        },
        {
          "tagId": "clue_borislav_started",
          "tagQuestion": "A witness says you threw the first punch. Is that true?",
          "responses": [
            {
              "responseSequence": ["Who said that? Was it Mara? She's always taking Goran's side.", "I pushed him first, maybe. But he provoked me."],
              "isLie": false,
              "stressImpact": 0.10,
              "responseType": "Defensive",
              "clickableClues": []
            }
          ],
          "unlocksTruthForTagIds": []
        },
        {
          "tagId": "clue_goran_injuries",
          "tagQuestion": "Goran has bruises on his face and a cut lip. You gave him those?",
          "responses": [
            {
              "responseSequence": ["He hit me too! Look at my knuckles.", "It was a fight. We both got hurt."],
              "isLie": false,
              "stressImpact": 0.06,
              "responseType": "Defensive",
              "clickableClues": []
            }
          ],
          "unlocksTruthForTagIds": []
        },
        {
          "tagId": "clue_borislav_motive",
          "tagQuestion": "You admit you were jealous of his pumpkin. That's why you started the fight?",
          "responses": [
            {
              "responseSequence": ["Jealous is a strong word.", "I spent three months on that pumpkin. He spent three months making sure everyone knew his was bigger. It got to me."],
              "isLie": false,
              "stressImpact": 0.06,
              "responseType": "Emotional",
              "clickableClues": []
            }
          ],
          "unlocksTruthForTagIds": []
        }
      ],
      "lawyeredUpResponses": [
        "It was a fight over a pumpkin. Are we really doing this?",
        "I'm not saying anything else about a vegetable.",
        "Just charge me and let me go home."
      ],
      "rattledResponses": [
        "It was stupid. The whole thing was stupid.",
        "My wife is going to kill me.",
        "Over a pumpkin. I'm here over a pumpkin."
      ],
      "shutdownResponses": [
        "...",
        "I'm done.",
        "It's a pumpkin. That's all I have to say."
      ]
    },
    {
      "citizenID": "citizen_goran",
      "firstName": "Goran",
      "lastName": "Petrovic",
      "picturePath": "Portraits/citizen_goran",
      "dateOfBirth": "04/19/1977",
      "gender": "Male",
      "ethnicity": "Caucasian",
      "maritalStatus": "Married",
      "address": "24 Garden Row, Block D",
      "occupation": "Pipe Fitter",
      "nervousnessLevel": 0.35,
      "initialStress": 0.20,
      "isGuilty": false,
      "criminalHistory": [],
      "tagInteractions": [
        {
          "tagId": "clue_enforcer_report",
          "tagQuestion": "The enforcer report says you were involved in a public fight. What happened?",
          "responses": [
            {
              "responseSequence": ["Borislav punched me. Out of nowhere.", "We were showing our pumpkins from the community garden. People were looking, having a nice time. Then he just snapped."],
              "isLie": false,
              "stressImpact": 0.04,
              "responseType": "Normal",
              "clickableClues": [
                {
                  "clueId": "clue_goran_account",
                  "clickableText": "he just snapped",
                  "noteText": "<person>Goran</person> says <person>Borislav</person> attacked him unprovoked while they were showing pumpkins at the community garden display",
                  "highlightColor": { "r": 1.0, "g": 0.92, "b": 0.0, "a": 1.0 },
                  "oneTimeOnly": true
                }
              ]
            }
          ],
          "unlocksTruthForTagIds": []
        },
        {
          "tagId": "clue_pumpkin_destroyed",
          "tagQuestion": "Your pumpkin was destroyed during the fight. Did Borislav do that?",
          "responses": [
            {
              "responseSequence": ["He grabbed it off the table and slammed it on the ground.", "Three months of work. Gone. Because he couldn't stand that mine was bigger."],
              "isLie": false,
              "stressImpact": 0.06,
              "responseType": "Emotional",
              "clickableClues": []
            }
          ],
          "unlocksTruthForTagIds": []
        },
        {
          "tagId": "clue_stall_damage",
          "tagQuestion": "A market stall was knocked over. Did you cause that?",
          "responses": [
            {
              "responseSequence": ["I was trying to get away from him. I backed into it.", "I didn't mean to damage anything. He was swinging at me."],
              "isLie": false,
              "stressImpact": 0.04,
              "responseType": "Normal",
              "clickableClues": []
            }
          ],
          "unlocksTruthForTagIds": []
        },
        {
          "tagId": "clue_borislav_started",
          "tagQuestion": "Did you provoke Borislav in any way?",
          "responses": [
            {